{
  "schema_version": "1.0.0",
  "id": "qwen3.5-0.8b-4bit-mlx",
  "task": "text-generation",
  "candidate_role": "small-efficiency-challenger",
  "source": {
    "repository": "Qwen/Qwen3.5-0.8B",
    "observed_revision": "2fc06364715b967f1860aea9cf38778875588b17",
    "license": "Apache-2.0",
    "parameter_count": 800000000,
    "context_tokens": 262144,
    "provenance_limit": "The conversion identifies Qwen/Qwen3.5-0.8B but does not name the exact source commit used. The observed revision pins capability and license evidence without claiming conversion identity."
  },
  "conversion": {
    "repository": "mlx-community/Qwen3.5-0.8B-4bit",
    "revision": "da28692b5f139cb0ec58a356b437486b7dac7462",
    "license": "Apache-2.0",
    "format": "MLX 4-bit safetensors with vision tower",
    "converter": "mlx-vlm 0.3.12",
    "quantization_bits": 4,
    "quantization_group_size": 64,
    "weight_bytes": 625229487,
    "snapshot_bytes": 652027143,
    "provenance_limit": "The conversion card pins mlx-vlm 0.3.12 but not its source-model commit."
  },
  "reference_runtime": {
    "repository": "ml-explore/mlx-lm",
    "revision": "ed1fca4cef15a824c5f1702c80f70b4cffc8e4dd",
    "version": "0.31.3",
    "license": "MIT",
    "mlx_repository": "ml-explore/mlx",
    "mlx_revision": "7a1d4f5c12ac82f4b4d0a6e71538d89ca0605247",
    "mlx_version": "0.32.0",
    "boundary": "Pinned Python reference over official Apple MLX; not an accepted product dependency or stable API"
  },
  "generation_contract": {
    "prompt_id": "surface-only-v1",
    "prompt_path": "benchmarks/postprocessing/prompts/surface-only-v1.txt",
    "prompt_sha256": "c8e31bcc1ed1169fa02e04f5504c7fc1e3599cf61b8272d6ee32cff0dbc889a7",
    "chat_template": "pinned model tokenizer template with enable_thinking=false",
    "chat_template_options": {
      "enable_thinking": false
    },
    "seed": 0,
    "temperature": 0.0,
    "max_tokens": 256,
    "stream": true,
    "cancellation_probe_after_tokens": 4,
    "rationale": "Greedy non-thinking decoding isolates surface-formatting behavior and makes the development runtime probe repeatable."
  },
  "result_contract": {
    "run_id": "phase5.qwen3.5-0.8b-4bit-mlx-reference.issue20-de-audiobook-whisper-1",
    "purpose": "development-runtime-probe",
    "fixture_path": "benchmarks/postprocessing/fixtures/issue7-de-audiobook-whisper.json",
    "result_path": "benchmarks/postprocessing/runs/phase5.qwen3.5-0.8b-4bit-mlx-reference.issue20-de-audiobook-whisper-1.json",
    "result_required": true
  },
  "artifacts": [
    {
      "path": "chat_template.jinja",
      "bytes": 7755,
      "sha256": "273d8e0e683b885071fb17e08d71e5f2a5ddfb5309756181681de4f5a1822d80"
    },
    {
      "path": "config.json",
      "bytes": 3112,
      "sha256": "ba7770da23eae5ebd6827571f086e331956b33f4442a9e876fb4aa10969a6772"
    },
    {
      "path": "model.safetensors",
      "bytes": 625229487,
      "sha256": "f5a0d9dd3efa73510542a8023d610ff26be2b4b020d181cfc4bedaa1fcc5dd9e"
    },
    {
      "path": "model.safetensors.index.json",
      "bytes": 71473,
      "sha256": "6e48f2fa5d6f033a6d77bf833abfa9698ca24d1715ecea4c67447bcfaee44650"
    },
    {
      "path": "preprocessor_config.json",
      "bytes": 390,
      "sha256": "27225450ac9c6529872ee1924fcb0962ff5634834f817040f444118116f4e516"
    },
    {
      "path": "processor_config.json",
      "bytes": 1300,
      "sha256": "14932921ca485d458a04dafd8069fbb0a4505622a48208d19ed247115801385b"
    },
    {
      "path": "tokenizer.json",
      "bytes": 19989343,
      "sha256": "87a7830d63fcf43bf241c3c5242e96e62dd3fdc29224ca26fed8ea333db72de4"
    },
    {
      "path": "tokenizer_config.json",
      "bytes": 1139,
      "sha256": "e98f1901ac6f0adff67b1d540bfa0c36ac1a0cf59eb72ed78146ef89aafa1182"
    },
    {
      "path": "video_preprocessor_config.json",
      "bytes": 385,
      "sha256": "7768af27c1fafa9cc9011c1dc20067e03f8915e03b63504550e11d5066986d13"
    },
    {
      "path": "vocab.json",
      "bytes": 6722759,
      "sha256": "ce99b4cb2983d118806ce0a8b777a35b093e2000a503ebde25853284c9dfa003"
    }
  ]
}
