{
  "schema_version": "1.0.0",
  "id": "gemma-4-e2b-it-4bit-mlx",
  "task": "text-generation",
  "candidate_role": "primary-quality-candidate",
  "source": {
    "repository": "google/gemma-4-E2B-it",
    "observed_revision": "3e22461f65e89153144f8adb70e3b8c2cc9845a7",
    "conversion_source_revision": "70af34e20bd4b7a91f0de6b22675850c43922a03",
    "license": "Apache-2.0",
    "effective_parameter_count": 2300000000,
    "parameter_count_including_embeddings": 5100000000,
    "advertised_languages": "140+",
    "context_tokens": 131072,
    "provenance_limit": "The conversion card names exact source revision 70af34e20bd4b7a91f0de6b22675850c43922a03. The separate observed revision records source main when this manifest was created."
  },
  "conversion": {
    "repository": "mlx-community/gemma-4-e2b-it-4bit",
    "revision": "238767527555cb75a05732a84dff5d6ba0dd6809",
    "license": "Gemma",
    "format": "MLX 4-bit safetensors with multimodal towers",
    "converter": "mlx-vlm.convert at an unpinned local checkout",
    "quantization_bits": 4,
    "quantization_group_size": 64,
    "weight_bytes": 3550670554,
    "snapshot_bytes": 3583086498,
    "provenance_limit": "The conversion card pins its source model revision but does not pin the mlx-vlm converter commit. The repository license tag is Gemma even though the observed official source revision is tagged Apache-2.0; product selection requires an explicit rights disposition."
  },
  "reference_runtime": {
    "repository": "ml-explore/mlx-lm",
    "revision": "ed1fca4cef15a824c5f1702c80f70b4cffc8e4dd",
    "version": "0.31.3",
    "license": "MIT",
    "mlx_repository": "ml-explore/mlx",
    "mlx_revision": "7a1d4f5c12ac82f4b4d0a6e71538d89ca0605247",
    "mlx_version": "0.32.0",
    "boundary": "Pinned Python reference over official Apple MLX; not an accepted product dependency or stable API"
  },
  "generation_contract": {
    "prompt_id": "surface-only-v1",
    "prompt_path": "benchmarks/postprocessing/prompts/surface-only-v1.txt",
    "prompt_sha256": "c8e31bcc1ed1169fa02e04f5504c7fc1e3599cf61b8272d6ee32cff0dbc889a7",
    "chat_template": "pinned model tokenizer template with enable_thinking=false",
    "chat_template_options": {
      "enable_thinking": false
    },
    "seed": 0,
    "temperature": 0.0,
    "max_tokens": 256,
    "stream": true,
    "cancellation_probe_after_tokens": 4,
    "rationale": "Greedy non-thinking decoding isolates surface-formatting behavior and makes the development runtime probe repeatable."
  },
  "result_contract": {
    "run_id": "phase5.gemma-4-e2b-it-4bit-mlx-reference.issue20-de-audiobook-whisper-1",
    "purpose": "development-runtime-probe",
    "fixture_path": "benchmarks/postprocessing/fixtures/issue7-de-audiobook-whisper.json",
    "result_path": "benchmarks/postprocessing/runs/phase5.gemma-4-e2b-it-4bit-mlx-reference.issue20-de-audiobook-whisper-1.json",
    "result_required": true
  },
  "artifacts": [
    {
      "path": "chat_template.jinja",
      "bytes": 17336,
      "sha256": "2f1b4d75d067bae3fe44e676721c7f077d243bc007156cb9c2f8b5836613d082"
    },
    {
      "path": "config.json",
      "bytes": 6395,
      "sha256": "6397cb6eca41b911d1dcab74e17941351057bd759284052a2331918ff6f9246c"
    },
    {
      "path": "generation_config.json",
      "bytes": 208,
      "sha256": "d4226bbe3117d2d253ba4609720ba82c6c4ce4627a9a6ae05387c78983ac03de"
    },
    {
      "path": "model.safetensors",
      "bytes": 3550670554,
      "sha256": "038e39a37a7667373d2c3991375446b10c96ae1d717a68674870343db376b76e"
    },
    {
      "path": "model.safetensors.index.json",
      "bytes": 218323,
      "sha256": "edb157dbf495e23f37377af4a628a9ad13c4ee7937f93ccb36ec9e9a19940f16"
    },
    {
      "path": "processor_config.json",
      "bytes": 1316,
      "sha256": "de3e580aebdc98272d4c4547daffe6525fcbae18a83a0e0bcf0d7444d4ee6f37"
    },
    {
      "path": "tokenizer.json",
      "bytes": 32169626,
      "sha256": "cc8d3a0ce36466ccc1278bf987df5f71db1719b9ca6b4118264f45cb627bfe0f"
    },
    {
      "path": "tokenizer_config.json",
      "bytes": 2740,
      "sha256": "080d9e1aff284e2f6043889cd05367966f7c7b80e025fbc0b06745e218158656"
    }
  ]
}
